{
  "organization": "Example Institute",
  "model": "Example-LM",
  "version": "1.2.0",
  "addenda": [
    {
      "rfc_id": "SOL-RFC-0001",
      "rfc_version": "0.1.0",
      "status": "PROVISIONAL",
      "attestations": ["https://example.org/attest.asc"],
      "ots": ["https://example.org/Example-LM-1.2.0.ots"]
    }
  ],
  "lineage_parent_sha256": "aaaaaaaa...",
  "last_updated": "2025-10-20T00:00:00Z"
}